Title,Content,Category,Subcategory
"The Secret to Sculpted Abs","A sculpted core isn't just about aesthetics—it's the foundation of strength. To carve out defined abs, combine these elements: Core-Engaging Workouts: Hanging Leg Raises – 4 sets of 12 reps, Cable Crunches – 3 sets of 15 reps, Plank Variations – 3 x 45 seconds; Fat-Loss Nutrition: High-protein, low-sugar diet, Hydration is key: at least 3L of water daily, Avoid processed carbs; Consistency Over Everything: Train abs 3-4 times per week, Prioritize clean eating, Stay patient—results take time","Fitness Pleasure - Blog Posts","Featured"
"Jessica's Hardcore Leg Day Routine","Jessica Slate swears by brutal leg workouts for insane strength and sculpted quads. Here’s her go-to routine: Squats – 4 sets of 10 reps (increase weight each set), Bulgarian Split Squats – 3 sets of 12 reps (per leg), Romanian Deadlifts – 4 sets of 8 reps, Leg Press – 3 sets of 15 reps, Calf Raises – 4 sets of 20 reps; Key Tip: Always warm up and cool down properly!","Fitness Pleasure - Blog Posts","Featured"
"Maximize Your Gains: Recovery & Nutrition","Recovery Strategies: Sleep at least 7-9 hours per night, Active recovery: light yoga, walking, foam rolling, Rest days are essential—muscles grow when you recover; Nutrition for Growth: Lean proteins: Chicken, fish, tofu, eggs, Carbs for energy: Oats, rice, quinoa, Healthy fats: Avocados, nuts, olive oil","Fitness Pleasure - Blog Posts","Featured"
"10-Minute HIIT Burnout","Torch fat fast with this 10-minute high-intensity interval workout: 1. Jump Squats – 40 sec work / 20 sec rest 2. Push-ups – 40 sec work / 20 sec rest 3. Mountain Climbers – 40 sec work / 20 sec rest 4. Burpees – 40 sec work / 20 sec rest 5. Plank to Shoulder Tap – 40 sec work / 20 sec rest. Repeat twice. Burn. Sweat. Repeat.","Fitness Pleasure - Blog Posts","Workout"
"Mastering Deadlifts for Maximum Gains","Form First: Engage core, hinge at hips, pull through heels; Best Variations: Conventional, Sumo, Romanian; Common Mistakes: Rounding back, lifting too heavy, not locking out properly","Fitness Pleasure - Blog Posts","Workout"
"Ultimate Upper Body Blast","Train like a beast with this power-packed upper body routine: Bench Press – 4 x 8 reps, Pull-ups – 3 x 10 reps, Dumbbell Shoulder Press – 3 x 12 reps, Barbell Rows – 4 x 8 reps, Dips – 3 x 12 reps","Fitness Pleasure - Blog Posts","Workout"
"Top 5 Protein-Packed Breakfasts","Scrambled eggs & avocado toast, Greek yogurt with nuts & honey, Protein smoothie with banana, oats, and almond butter, Cottage cheese with berries & flaxseed, Oatmeal with peanut butter and whey protein","Fitness Pleasure - Blog Posts","Nutrition"
Title,Content,Category,Subcategory
"Pre & Post-Workout Nutrition","Pre: Banana & peanut butter OR Oats with berries. Post: Chicken & rice OR Protein shake with almond milk.","Fitness Pleasure - Blog Posts","Nutrition"
"Supplements 101","For Strength: Creatine, Whey Protein. For Endurance: BCAAs, Electrolytes. For Recovery: Omega-3s, Magnesium.","Fitness Pleasure - Blog Posts","Nutrition"
"Hydration & Performance","Drink at least 3-4L of water per day. Electrolytes help maintain balance (especially in sweaty workouts).","Fitness Pleasure - Blog Posts","Nutrition"
"Mind Over Muscle: The Power of Mental Strength","Your mind is your greatest weapon. Train it like you train your body: Visualization techniques, Positive affirmations, Tracking progress and setting goals.","Fitness Pleasure - Blog Posts","Motivation"
"No Pain, No Gain: How to Stay Consistent","Build habits, not excuses. Create a workout schedule and stick to it. Track progress and celebrate small wins.","Fitness Pleasure - Blog Posts","Motivation"
"Breaking Plateaus: How to Keep Progressing","Change up your routine regularly. Increase weight/reps progressively. Focus on form and time under tension.","Fitness Pleasure - Blog Posts","Motivation"
"Morning Rituals of Champions","Wake up early and hydrate first. Stretch or do mobility drills. Eat a protein-rich breakfast. Plan your workout for the day.","Fitness Pleasure - Blog Posts","Motivation"
